{"record_type":"source_coverage","schema_id":"ghostrace.source-coverage","schema_version":1,"contract_version":1,"observed_event_count":8,"statuses":[{"kind":"events_observed","source":"filesystem","count":4}],"gaps":[{"event_id":"00000000-0000-4000-8000-000000000010","interval":{"source":"filesystem","start":"2026-01-01T00:00:00Z","end":"2026-01-01T00:01:00Z"},"reason_code":"history_dropped","dropped_count":2,"from_cursor":"cursor-0001","to_cursor":"cursor-0002"}],"gaps_truncated":false,"retention_deletion_detected":false,"marker_filter_ignored":false,"opted_out":false}
